{
  "schema_version": "1.0",
  "id": "550e8400-e29b-41d4-a716-446655440030",
  "type": "mcp_tool",
  "name": "Oracle DB 메타데이터 조회",
  "version": "1.0.0",
  "owner": {
    "org": "miracom",
    "team": "platform",
    "creator_id": "admin@miracom.com"
  },
  "classification": "INTERNAL",
  "description": "허용된 Schema의 Table 목록을 조회합니다 (읽기 전용, PoC). 건수 조회는 별도 자산인 '테이블 건수 조회'가 담당합니다.",
  "tags": ["oracle", "readonly", "metadata"],
  "manifest_hash": "0000000000000000000000000000000000000000000000000000000000000000",
  "changelog": "Initial MCP tool — READ_ONLY only per PoC policy. tool_name/input_schema/output_schema aligned to 05-mcp-security-governance.md §5.1 (db_metadata.get_tables). D-049: the get_columns/table_count.query siblings now have their own Portal manifest fixtures (fixtures/valid/mcp-db-metadata-get-columns, fixtures/valid/mcp-table-count-query), and tests/contract/test_mcp_tool_fixtures.py keeps all three from drifting away from services/office-mcp-server's registry.",
  "created_at": "2026-08-01T09:00:00Z",
  "server_alias": "oracle-connector",
  "tool_name": "db_metadata.get_tables",
  "risk_level": "READ_ONLY",
  "input_schema": {
    "type": "object",
    "required": ["schema"],
    "additionalProperties": false,
    "properties": {
      "schema": {
        "type": "string",
        "description": "Schema Allowlist에 포함된 Schema만 허용"
      },
      "name_contains": {
        "type": "string",
        "description": "테이블명 부분 일치 검색어 (선택)"
      },
      "limit": {
        "type": "integer",
        "minimum": 1,
        "maximum": 100,
        "default": 50
      }
    }
  },
  "output_schema": {
    "type": "object",
    "properties": {
      "items": {
        "type": "array",
        "items": {
          "type": "object",
          "properties": {
            "schema": { "type": "string" },
            "table": { "type": "string" },
            "comment": { "type": "string" }
          }
        }
      },
      "truncated": { "type": "boolean" }
    }
  },
  "execution_guards": {
    "timeout_seconds": 10,
    "max_rows": 1000,
    "max_bytes": 1048576,
    "requires_user_confirmation": false
  },
  "permissions": {
    "allowed_roles": ["CREATOR", "TECH_REVIEWER"],
    "allowed_orgs": ["miracom"]
  }
}
